{
  "business_context":"B2B exporter selling industrial products through distributors and direct enterprise accounts.",
  "crm_goal":"Design an evidence-backed CRM architecture before implementation.",
  "target_markets":["Vietnam","Philippines"],
  "priority_capabilities":["Company","Lead","Pipeline","Automation","AI"]
}
